{"schema_version":"demo-story.redhat-intel.com/virtualization-ai-501/qualification-response/v1","request_id":"qualification-healthy-001","decision":"ALLOW_REVIEW","reason":"Qualification Envelope Satisfied","source_state":"REHEARSAL","reason_codes":["QUALIFICATION_ENVELOPE_SATISFIED"],"policy":{"id":"virtualization-ai-501-fleet-qualification","version":"0.1.0","matched_rules":["allow-human-promotion-review"]},"authority":{"human_promotion_required":true,"promotion_performed":false,"certification_performed":false,"llm_authority":"NONE"},"qualification":{"status":"PASS","fleet_size":3,"trial_results":[{},{},{}],"envelope":{}},"evidence":[{"schema_version":"demo-story.redhat-intel.com/virtualization-ai-501/evidence/v1","evidence_id":"result-healthy","request_id":"qualification-healthy-001","state":"HANDOFF","kind":"DECISION","source":"qualification-adapter","source_state":"REHEARSAL","observed_at":"2026-09-28T12:05:00Z","freshness":"FRESH","digest":"sha256:bbbbbbbbbbbbbbbbbbbbbbbbbbbbbbbbbbbbbbbbbbbbbbbbbbbbbbbbbbbbbbbb","payload":{}}]}
