{"schema_version":"demo-story.redhat-intel.com/virtualization-ai-501/qualification-response/v1","request_id":"qualification-correlation-001","decision":"ABSTAIN","reason":"Correlation Incomplete","source_state":"REHEARSAL","reason_codes":["CORRELATION_INCOMPLETE"],"policy":{"id":"virtualization-ai-501-fleet-qualification","version":"0.1.0","matched_rules":["abstain-correlation-incomplete"]},"authority":{"human_promotion_required":true,"promotion_performed":false,"certification_performed":false,"llm_authority":"NONE"},"qualification":{"status":"INCOMPLETE","fleet_size":3,"trial_results":[{},{},{}],"envelope":{}},"evidence":[{"schema_version":"demo-story.redhat-intel.com/virtualization-ai-501/evidence/v1","evidence_id":"result-correlation","request_id":"qualification-correlation-001","state":"HANDOFF","kind":"DECISION","source":"qualification-adapter","source_state":"REHEARSAL","observed_at":"2026-09-28T12:05:00Z","freshness":"FRESH","digest":"sha256:dddddddddddddddddddddddddddddddddddddddddddddddddddddddddddddddd","payload":{}}]}
